{
  "schema": "schindler-profile",
  "schema_version": "0.1.0",
  "catalog_version": "0.2.0",
  "name": "identity",
  "description": "Pass-through reference. All controls at defaults — 100% saturation, identity matrix, full-range RGB.",
  "factory": true,
  "controls": {
    "color.saturation":         100,
    "color.matrix.preset":      "identity",
    "color.matrix_saturation":  100,
    "color.correct.black_r":    0,
    "color.correct.black_g":    0,
    "color.correct.black_b":    0,
    "color.correct.white_r":    255,
    "color.correct.white_g":    255,
    "color.correct.white_b":    255,
    "scaler.kernel_h":          "boxcar_2tap",
    "scaler.kernel_v":          "boxcar_2tap"
  }
}
